,name,desc
1224,Koyj Company,"Manufacturer and seller of composite optical materials in South Korea. The company offers optical components,"
1225,Zamba,Provider of wireless mobile data communication services. The company provides mobile data communication software products
1226,ZetaRx Biosciences,Operator of biotechnology company. The company engages in the development of therapies for cancer and
1227,Shopcastr,Provider of an online and mobile platform for independent local retailers and shoppers. The company
1228,Yobble,Developer of a hybrid hardware/software technology for iPhone. The company is a mobile motion sensing
1229,Micro Technologies,"Developer of transformational security devices. The company provides security products, including vehicle security systems, fleet"
1230,Frisørkjeden Tango Norge,Operator of a hairdressing chain. The company was established because of the growing demand for
1231,Bridge Medical,Provider of patient safety software and services to the healthcare industry. The company offers point-of-care
1232,DeerTech,Provider of three circles of protection to protect plants from deer to homeowners. The company
1233,Insightix,"Provider of security intelligence and control solutions. The company offers Business Security Assurance Suite, which"
1234,Miraphonic,"Developer of online social game on the iPhone, Facebook, and Twitter under the name Epic"
1235,Summit Access,Developer of interventional radiology device. The company develops radiology devices to streamline the Seldinger technique
1236,Agiliti,"Provider of information technology services. The company offers services that helps companies reduce costs, reduce"
1237,Anevia,Provider of video on demand software. The company offers application suites for broadcasters and telecom
1238,SwapDrive,Provider of Web-based operating software for online data backup and storage. The company’s services allow
1239,Voyager Therapeutics,Provider of gene therapies for diseases of the central nervous system. The company is a
1240,Motilal Oswal Financial Services,"Provider of equity research services. The company provides market research, technical and derivative analysis and"
1241,Tempo Payments,"Provider of payment technology for debit card related technologies. The company offers Tempo Debit, a"
1242,Urovalve,Developer of medical devices that address problems with urinary tract functions. The company offers remote-controllable
1243,Corvascular,Provider of technology for minimally invasive cardiac surgery. The company is the developer of the
1244,CoSoSys,Developer of network endpoint security and portable storage device enhancement solutions. The company also provides
1245,Shaser Bioscience,Developer of aesthetic dermatological technology for home use devices. The company develops technology for the
1246,ubalo,Provider on an online platform for numerical computing. The company provides interactive demos with the
1247,Guaranteach,"Provider of online math classes for students, parents, and teachers. The company offers streaming videos"
1248,Scalado,"Operator of a mobile imaging company. The company develops software for creating, presenting and transferring"
1249,Touchstone Semiconductor (Analog IC Products),"Designer and manufacturer of high-performance analog integrated circuits. The company provides high-performance, low-power analog IC"
1250,Ziff Davis Enterprise,"Provider of online content, lead generation services, events and publications serving the technology industry. The"
1251,Webupdate,"Provider of internet consulting. The company specializes in the maintenance, updating and development of websites,"
1252,Concord Data Systems,"Manufacturer of telecommunication equipment. The company designs and sells broadband and carrierband modems, network management"
1253,Niagara Growth,Provider of funding to businesses with less than one million dollars in assets and the
1254,Terraspring,"Developer and provider of management software. The company provides service for the automated deployment, management,"
1255,Diaxonhit,Developer of RNA-based diagnostic tests. The company is engaged in developing RNA-based diagnostic tests and
1256,Capsant Neurotechnologies,Provider of a technology platform based on organotypic slice cultures. The company focuses on solving
1257,SteelTrace,Developer of business process and requirement tools. The company develops tools that increase the accuracy
1258,EpiWorks,Manufacturer of specially treated gallium arsenide and indium phosphide wafers. The company\'s wafers are used
1259,Energetic Solutions,"Developer of electromagnetic pest repellants. The company\'s products, shoo!TAG and shoo!BUG, are designed to protect"
1260,Redstone Communications,"Developer of networking equipments and market service provider solutions that address the scalability, performance, reliability"
1261,NanoVasc,Operator of a medical device company. The company designs and manufactures bio mimetic materials that
1262,Cloud.com,Provider of open source software solutions for enterprises and service providers. The company offers an
1263,Connection Services,Provider of Wi-Fi Services. The company provides enabling technology to the wireless service businesses of
1264,Appscio,"Developer of applications of media mining algorithms to government, enterprise, and Web media management problems."
1265,Rehab Associates,Provider of physical and occupational therapy services in owned and managed free-standing clinics and hospital
1266,Cove Financial Group,Provider of a mortgage-alternative program for residential consumers. The company offers a program for would-be
1267,DecisionView,Developer of web-based clinical optimization solutions for the life sciences industry in the United States
1268,Volunteers in Health Care,Provider of web-based medication assistance resource centers. The company provides a current and comprehensive database
1269,Banner Pharmacaps,Developer of gelatin based dosage forms. The company focuses on delivering proprietary softgel formulations for
1270,Chancery Software,Provider of school administration and curriculum management software. The company\'s software tools help in the
1271,Sifteo,"Developer of tabletop gaming consoles. The company offers Siftables, a set of cookie-sized computers with"
1272,Nukona,Provider of mobile application management technologies. The company\' application center is an end-to-end mobile information
1273,Okapi Sciences,Developer of drugs to treat viral infections for both pets and livestock. The company engages
1274,Vergent Medical Systems,Provider of medical technology. The company also provides X-ray beam-shaping technology to produce a low-energy
1275,PicPlz,"Provider of a photo sharing application. The company\'s platform integrates with Facebook, Twitter, Flickr, Tumblr,"
1276,Zapera.com,Provider of market research services. The company offers online market research services in the Nordic
1277,Maxim Integrated Products,"Designer, manufacturer and seller of analog and mixed-signal semiconductor products. The company markets a range"
1278,SecuroNet,Provider of software and networking services. The company enables public and private subscribers to join
1279,Interweave Software,Developer of information delivery products. The company\'s products allow information technology organizations to deploy intranet
1280,PhoneAndPhone,Provider of online retail. The company sells a range of mobile phones with or without
1281,Small Smiles Dental Centers,Provider of dental care services. The company provides dental care services for children.
1282,CIMLINC,Developer of custom and multimedia work instruction software for the manufacturing industry. The company provides
1283,Xterprise,Developer of radio frequency identification supply chain services. The company also offers RFID item-level inventory
1284,CarouCell,Developer of equipment for in vitro drug-testing methods. The company is the creator of a
1285,SDL,Provider of language translation services.
1286,All Optical Networks,"Provider of technology and services to the telecommunication industry. The company provides transmission, routing and"
1287,Cartesia Dx,Developer of thermal/3D imaging system to quantify inflammation and to diagnose and manage rheumatoid arthritis.
1288,Moa Group,"Producer and distributor of beverages. The company produces beer, wines and cocktails, employing methode traditionnelle"
1289,CityReach International,"Provider of telecommunications, data communications, internet and web hosting services. The company provides services such"
1290,Academic Services Ambulance Partnership,Operator of a medical transportation company in Belgium. The company provides non-emergency ambulance services.
1291,Demonstrate,Provider of brand activation and communication related services. The company offers equity storytelling campaigns related
1292,Sightward,Developer and Supplier of predictive software that helps marketing professionals maximize revenue. The company also
1293,AdBrite,Provider of an advertisement exchange platform. The company helps advertisers and publishers for selection and
1294,BiBC,Provider of streaming and hosting services for visual media. The company uses webcasting technology to
1295,XtremIO,Developer of solid-state drive data storage systems. The company develops platform that will help shared
1296,Ultra Fog,Developer of a high-pressure sprinkler system for firefighting purposes. The company is the creator of
1297,Novas,"Provider of design comprehension solutions. The company\'s solutions enhance verification of complex Ics, embedded systems"
1298,Eyetel Imaging,Developer of imaging technologies to address vision loss due to undetected and untreated diabetic retinopathy.
1299,Genoway,Developer of genetically modified rat and mouse models for use in in vivo target validation
1300,Eidogen,"Developer of computational drug discovery platforms. The company offers Target Informatics Platform, structural proteomics enterprise"
1301,Followap,Provider of instant messaging and interconnect solutions. The company enables operators to provide real-time communication
1302,Ubiqi Health,Provider of online tools for migraine management. The company provides online and mobile application tools
1303,B1 Medical,Manufacturer of medical devices for the orthopedics market. The company develops and markets products such
1304,Applied Digital Access,"Provider of network performance management solutions to telecommunications service providers. The company focuses on systems,"
1305,TapCanvas,"Developer of a tool to build single-use mobile applications. The company focuses on building disposable,"
1306,IPLSHOP,Provider of a marketing platform. The company provides a network platform of waxing professionals and
1307,Pickup Services,Developer of software for the parcel-delivery industry across France. The company provides a software platform
1308,Neugenesis,"Developer of technology for the discovery, improvement and production of complex proteins especially heteromeric proteins."
1309,Lightspeed International,Provider of voice signalling translation technology. The company develops software that assists in managing voice
1310,Pendrell,Provider of corporate intellectual property services and litigation insights. The company is a next-generation MSS
1311,Double-Take Software Canada,"Provider of software solutions for data protection and recovery. The company serves legal, educational, government,"
1312,My Star Autograph,Provider of an e-commerce platform for selling merchandise signed by celebrities. The company operates a
1313,mimoOn,Developer of LTE software for mobile devices and wireless infrastructure. The company offers physical layer
1314,EdgeSeven,Provider of information security that delivers situational awareness capabilities to organizations.
1315,Ultracom Communications Holdings,Supplier of broadband network systems-on-silicon. The company offers silicon subsystems and VLSI-based subsystems to telephony
1316,Superbly,Developer of a psychometric screening tool. The company offers a software that enables organizations to
1317,Rewired Production Management,Developer of internet based systems to manage the information flow required to employ and pay
1318,iCompression,"Provider of real-time video and audio compression and communications technology to the consumer, computer, and"
1319,Unified Nexsys,Manufacturer of software and hardware technologies for education and military markets. The company\'s configuration service
1320,SEI Investments,SEI Investments Co was incorporated in Pennsylvania in 1968. The Company is a provider of
1321,Commercetools,Provider of cloud based e-commerce services. The company develops and operates as an e-commerce service
1322,Camelot Information Technologies,Operator of a network intelligence technology company. The company\'s technology utilizes discovery algorithms to analyze
1323,Steelscreen,Provider of an online marketplace for metal products. The provides an online trading platform for
1324,Heysan,Provider of mobile social messaging and community services. The company provides mobile Web based service
1325,Cube 6 Technologies,Developer of software for business operations. The company develops software that enables a service company
1326,TriQuest,Developer of computer chip design software. The company specializes in enhancing synthesis tools in the
1327,Junglee.com,Provider of shopping information over the internet. The company creates giant databases of highly targeted
1328,AlphaHelix Molecular Diagnostics,Developer of DNA chips for process analysis. The company uses its DNA chips for mutation
1329,Amnis,Manufacturer of cell analysis systems for the imaging and analysis of cells in flow. The
1330,Giant Realm,Operator of an online publishing platform. The company provides a vertical advertising network targeting the
1331,Evalve,Developer of devices that repair cardiac valves. The company provides a non-surgical mitral valve repair
1332,Innocent Drinks,Manufacturer and marketer of fruit smoothies and vegetable entrees. The company provides a line of
1333,Odyssey Clubs Group,"Operator of health and fitness clubs. The company offers health club facilities including pool, gym,"
1334,Clickmarks,Provider of technology solutions for development of e-business applications and web services. The company provides
1335,Codima Technologies,"Developer of software tools for organizations. The company enables users to view, maintain and store"
1336,RP Holdings,"Provider of mortgage default services. The company offers non-legal administrative, accounting, technology and information, data"
1337,LVL7 Systems,"Provider of software solutions to modern businesses. The company offers web design and development, Internet"
1338,Dave Networks,Provider of integrated video distribution and social community platforms. The company utilizes the latest matrix
1339,Zafgen,Developer of biopharmaceutical treatments for severe obesity. The company develops obesity therapeutics for use in
1340,Open Mind,Provider of internet based services. The company provides software services for internet based collaboration.
1341,Wooboard,"Operator of a cloud-based peer recognition platform. The company\'s platform builds up morale, productivity and"
1342,Innovative American Technologies,"Manufacturer of advanced radiological sensor systems, alternative energy systems, mocro and nano sensor systems applied"
1343,ChipScale,Provider of wafer level packaging. The company provides Micro SMT packaging technology. The company refines
1344,Adenosine Therapeutics,Developer of novel pharmaceutical products that target adenosine receptor subtypes. The company develops drugs for
1345,First Flavor,Provider of marketing service for brand marketers. The company\'s Peel \'n Taste System integrates with
1346,Zeal,"Provider of eyewear. The company offers sunglasses, goggles and RX eyewear for men, women and"
1347,Si-Nor,"Operator of trash removal and recycling. The company engages in refuse collection, trash removal and"
1348,ultraBridge,Provider of a technology service to the long term care industry. The company provides its
1349,Bego (Mechanical Engineering),Operator of a mechanical engineering company. The company is engaged in industrial mechanics and metalworking.
1350,3V Transaction Services,Provider of stored value accounts and standard and contactless payment cards. The company also provides
1351,Oferton Liveshopping,"Operator of live shopping website. The company offers sale in various product categories like electronics,"
1352,American Boarding,Provider of real estate services. The company offers real estate properties and rental housing products
1353,VuCOMP,Developer of computer-aided detection systems for automatic analysis of medical images. The company help physicians
1354,GWS Photonics,Developer of tunable components. The company produces tunable components for fiber optic dense wavelength division
1355,OREX,Supplier of x-ray machines. The company provides computerized radiography products which enable medical practitioners to
1356,VARStreet,Provider of specialized e-commerce services. The company offers E-Commerce Platform features several modules that include
1357,Jambo,Provider of net-to-phone software for connecting web searchers directly with local businesses via phone. The
1358,PlaySpan,"Provider of monetization solutions for online games, virtual worlds, and social networks. The company designs"
1359,Advanced Technologies Center,Developer and manufacturer of scanning probe microscopes and its software. The company\'s products are used
1360,OPX Biotechnologies,Developer of bio-based fuels. The company uses proprietary bioengineering technology to convert renewable feedstocks into
1361,FICS Group,Provider of an internet based application for the financial services industry. The company provides java-based
1362,YDreams,"Developer of a patent-pending technology. The company develops full-scale interactive environments, products and intellectual property"
1363,One Jackson,Developer of e-commerce platform for kids clothing. The company provides an online platform that offers
1364,Pipette,Provider of a health monitoring platform. The company provides mobile application which provides easy reports
1365,Aerocrine,Creator of a device to monitor inflammatory airway diseases. The company provides a device to
1366,BVfon Telecommunications,Provider of telecommunication and payment applications for detention facilities. The company offers an information technology
1367,Konarka Technologies,Developer of specialized photovoltaic materials used to convert light to energy. The company develops and
1368,GeoTel Communications,Provider of call routing and optimization software products. The company develops and markets telecommunication software
1369,MacroMill,Provider of online application tool for market research. The company has an automatic online research
1370,Photonics Applications,Manufacturer of fiber-optic transmission technology for cable and wireless communications networks. The company also provide
1371,MetraTech,"Provider of web based services for billing, customer self care and partner management. The company\'s"
1372,Scimagix,Provider of image informatics solutions for the pharmaceutical and biotech industries. The company offers proprietary
1373,Molecular Biometrics,Developer of non-invasive clinical tools to evaluate normal biologic function. The company offers medicines and
1374,Medico.com,Provider of an online global health portal. The portal allows users across the globe to
1375,GTESS,Provider of healthcare claims processing service. The company\'s custom solutions edit and clean claims by
1376,IL&FS Transportation & Networks,"Developer of surface transport infrastructure projects. The company constructs and operates national and state highways,"
1377,Gecko Alliance,"Manufacturer of electronic controls. The company offers systems, controls, pumps, audio, accessories and bath products."
1378,Koor Industries,"Investor of companies in agrochemicals, finance, telecommunications and asset management sectors. The company actively invests"
1379,Nabriva Therapeutics,"Provider of pharmaceutical research and development services. The company focuses on antibiotic classes, such as"
1380,Clan Match Exchange Good Game,Provider of online gaming services. The company provides server exchange and tournament registrations for different
1381,Edge Therapeutics,"Provider of therapeutic products for acute, fatal and debilitating medical conditions. The company develops implantable"
1382,Wind & Sail Energy,Provider of wind-turbine technology. The company\'s technology helps in solving problems associated with propeller-driven turbines.
1383,Coquelux,Provider of fashion purchase club website. The company is online shopping club that caters towards
1384,Torrex Equipment,Developer of semiconductor manufacturing equipments. The company has developed a technology for front-end thermal film
1385,Abakus,Developer and provider of a Web-based electronic patient-record system. The company\'s products supports physiotherapists in
1386,Ensure Medical,Developer of devices for post catheterization closure of the femoral artery. The company offers femoral
1387,Dresdner Factoring,Provider of financing services for small and medium enterprises. The company provides capital to smaller
1388,Cezanne HR,Developer of an online human resources software system and talent management services. The company offers
1389,Xanthus Pharmaceuticals,Developer of small-molecule therapeutics for the treatment of cancer and autoimmune disorders.
1390,Orchestria,Designer and provider of software and solutions targeted at information protection and control. The company
1391,Brainstorm SMS Technologies,Provider of a SMS messaging platform. The company enables businesses to reach customer through their
1392,Tuniu.com,"Provider of online travel services for travelers departing from the Chinese cities Beijing, Shanghai, Guangzhou"
1393,Snocap,"Provider of digital licensing and copyright management services. The company offers MyStores, which enables artists"
1394,Authix Technologies,Developer of a product authentication system. The company designs small unique tags that will be
1395,Matrix Therapeutics,Developer of drugs for the treatment of cancer and inflammatory diseases. The company\'s product TO2
1396,Oceania,Provider of electronic medical records software. The company aims to maintain patient records electronically to
1397,Simpler Networks,Manufacturer of telecommunications equipment and software. The company specializes in automated distribution frames enabling copper
1398,Mobango,Provider of mobile social networking platform. The company operates in the field of online and
1399,BruCells,Developer of therapeutic cellular vaccines. The company produces vaccines based on dendritic cells. It also
1400,Insurancewide.com Services,Provider of online insurance comparison services. The company designs different insurance services to help customers
1401,ReTargeter,Provider of an online display advertising platform. The company offers services for brand awareness and
1402,Mavent,"Provider of an automated regulatory compliance solutions. The company offers Mavent Expert System, a knowledge-based"
1403,CoAlign Innovations,Developer of a less invasive and more anatomically correct spinal fusion. The company develops a
1404,Ingrepro,Producer of algae for industrial purposes. The company engages in the development and exploitation of
1405,Decide,Provider of an online shopping and price-information service. The company mines data on price points
1406,Radiant Medical,Developer of endovascular temperature therapy products. The company offers its products to advance the treatment
1407,Headway Technologies,Manufacturer and supplier of magnetoresistive heads to the disk drive industry. The company develops magnet
1408,iTouch,"Provider, marketer and distributor of mobile content and entertainment products and services. The company is"
1409,Cerent,Manufacturer of optical transport platform for service provider.
1410,Kailight Photonics,Developer of optical modules for the global telecommunications industry. The company’s components make it possible
1411,Solid Information Technology,"Provider of proprietary database products. The company also provides various consulting services, which include technical"
1412,Symplified,"Provider of identity infrastructure for the on demand market. The company provides KeyChain, which provides"
1413,Velocity Medical Solutions,Developer of imaging software to improve cancer treatment. The company offers a software which could
1414,Brightware,"Developer of eCustomer Assistance software for the Internet. The company\'s products provide automated, self-service assistance"
1415,The SLTN Group,"Provider of consulting and advisory services for implementation, management and migration of issues in profit"
1416,Smarterphone,Provider of an operating system for mobile phones. The company provides software to enable original
1417,Swoopt,Provider of a mobile platform for Fantasy Sports. The company provides fantasy sports gaming and
1418,InitMe,"Provider of software development services. The computer offers adaptive software development, computer repair, collaborative software"
1419,Pelydryn,"Provider of airborne surveying and hydrographic services. The company\'s services includes project management, bathymetric and"
1420,Z-Tech,Developer of cancer screening technology. The company has developed a a system that detects changes
1421,USCS International,"Provider of customer management software and statement processing to the communications, utilities and other service"
1422,Xoomsys,Provider of simulation solutions based on decoupling and distributed processing technology for circuits. The company
1423,Atrenta,Provider of realization services for the semiconductor and electronic systems industries. The company designs and
