,name,desc
2432,Distill,Creator of a browser-based recruiting platform. The company provides a suite of products that enables
2433,BMDSys Production,Developer of cardiac diagnostic imaging systems. The company uses magnetic field imaging system in medical
2434,WizBill,Provider of an expert system for the telecommunication industry. The company offers a platform for
2435,Presens,"Developer of pressure-sensor devices. The company develops temperature and flow-measurement products for the aerospace, automotive"
2436,Micropolis,Manufacturer of high capacity/performance disk drives. The company provides high capacity mini floppy disk drives
2437,Serrot International,"Provider of plastic linings fabricator which serves the metals refining, plating and water/waste water treatment"
2438,GeneOhm Sciences,"Developer of nucleic acid-based diagnostic services. The company offers methicillin-resistant Staphylococcus aureus (MRSA) Assay, an"
2439,Qubulus,Provider of platform for indoor positioning systems. The company provides a positioning platform for smartphones
2440,Zaprica,Operator of a user experience design company. The company defines and strategizes user experiences for
2441,AppFolio,Provider of software-as-a-service products for small and mid-sized businesses. The company provides business accounting and
2442,ShareBloc,Provider of an online enterprise vendor comparison platform. The company provides enterprise consumers with an
2443,XLight Photonics,Manufacturer of tunable transponders. The company develops and commercializes next-generation optical switching fabrics for multi-terabit
2444,AudioFeast,Provider of MP3 players with a web-based broadcast network of digital audio programming. The company
2445,Pages Software,"Provider of web development technologies. The company\'s technology is used in corporate brochure Web sites,"
2446,Visiometrics,"Developer and manufacturer of medical instruments. The company develops and manufactures instruments to measure, diagnose"
2447,EndoTex Interventional Systems,Developer of interventional vascular therapeutic solutions. The company focuses on developing less invasive solution to
2448,Wine Preserva,"Developer of device to preserve the quality of wine. The company offers Wine Shield, an"
2449,Ester Neurosciences,Developer of therapeutic products for the treatment of neurological disorders. The company provides novel therapeutic
2450,TapCommerce,Provider of mobile-retargeting services. The company provides a software platform to help brands engage and
2451,Synaptic Systems,Provider of software services for financial advisers. The company provides detailed information across the total
2452,Seaside Software,Designer and manufacturer of corporate messaging and intranet applications for the corporate market. The company
2453,Botnia Exploration,Miner of rare minerals. The company is aggressive in its exploration and prospecting of new
2454,Reciprocal,Provider of digital rights management and digital commerce services. The company offers end-to-end e-commerce services
2455,BioRelix,Developer of anti-infective drug treatments. The company is focused on building a portfolio of anti-infective
2456,Equitalk,"Provider of low cost, paperless, telephone service. The company\'s processes are automated, the customers are"
2457,Third Millennium Healthcare Systems,"Provider of revenue cycle management software. The company provides automate rejected or denied claims management,"
2458,Bio Architecture Lab,Developer of a technology that enables the production of ethanol from kelp sugars. The company
2459,theAudience,"Provider of social media distribution platform. The company provides content for Twitter, Facebook and other"
2460,Signature Genomic Laboratories,"Provider of molecular cytogenetic diagnostic services. The company offers diagnostic services, including pediatric and adult"
2461,1747,Provider of web enabled systems to conduct clinical trials directly with participants. The company\'s product
2462,Dynamic Payment Ventures,Provider of payment processing services.
2463,LocoMobi,Provider of software and hardware for security services. The company provides software and hardware for
2464,Aux Interactive,Provider of interactive agency through social media marketing and surrounding technologies. The company focuses on
2465,Enterupt,"Operator of an online platform for advertisement. The company\'s faceified service enables sellers, service providers"
2466,Proacta,Developer of oncology drugs. The company provides cancer-related products which targets the physiological attributes of
2467,Mapletree Networks,"Manufacturer of circuit and packet-based voice, data, and fax network access and core network infrastructure."
2468,Gruvie.com,Provider of social network platform to aggregate their social web content into one location.
2469,Premier VCT (Dartford),Owner and operator of a hotel. The company owns 12 bedrooms hotel in Dartford.
2470,Ad Valem Technologies,Provider of data storage and broadcasting services. The company specializes in the broadcasting and management
2471,Hojoki,Provider of a cloud based applications to solve the problem of information fragmentation. The company
2472,Plant Genetic Systems,"Developer of genetically engineered plants. The company is a biotech company lacated in Ghent, Belgium."
2473,Spiralcat,Provider of water and biofuel renewable services. The company recovers water and biofuel using harvesting
2474,Enginion,"Provider of technology in the field of steam-operated, compact cogeneration systems. The company offers SteamCell,"
2475,Warrior Group,Operator of a permanent modular construction company. The company provides construction services for projects such
2476,Cemmerce,Operator of an online commerce platform. The company helps publishers and content creators generate new
2477,Core Networks,"Provider of a suite of applications for the broadband industry. The company offers provisioning, network"
2478,Mpex Pharmaceuticals,"Developer of therapies for antibiotic resistance. The company offers MP-376, a proprietary formula of levofloxacin"
2479,Qype,Provider of a consumer review website for goods and services in Europe. The company offers
2480,CE Interactive,"Provider of digital products and services to consumer electronics retailers, manufacturers, service providers, and consumers."
2481,Discern Communications,Developer of automated self-service question answering software for call centers.
2482,PeriphaGen (Formerly Diamyd),Operator of a bio-pharmaceutical company. The company develops gene delivery products to treat and manage
2483,Everloop,Operator of an online social platform for kids. The company enables kids to connect with
2484,Veo Television,Provider of television broadcasting services in Spain.
2485,Orbot Instruments,Manufacturer of a semiconductor inspection equipment. The company provides automated optical inspection for semiconductor industry.
2486,Backupify,"Provider of online data backup services. The company\'s service enable users to protect their pictures,"
2487,Alpharel,Developer of data-management systems.The company develops multi-terabyte engineering-data systems.
2488,BeSang,Provider of semiconductor. The company provides fabless semiconductor focusing on developing proprietary 3D integrated circuit
2489,Tedopres International,Provider of content management services and software for technical documentation. The company by means of
2490,Intermetro Communications,Provider of voice and data communication services.The company operates VoIP switching equipment and network facilities
2491,Novus Packaging,"Manufacturer of extrusion-coated and laminated packaging materials serving the food, pharmaceutical and industrial markets. The"
2492,Telogy Networks,Developer of asymmetric digital subscriber line semiconductors. The company\'s golden gateway software enables its customers
2493,FanLib,Operator of online community for the entertainment fans. The company\'s online storytelling platform enables its
2494,BluMetric Environmental,Designer of onsite wastewater treatment systems for domestic and industrial sites. The company offers products
2495,Tapely,Operator of a music sharing platform. The company creates and shares music mixtapes online. It
2496,Reasoning,Provider of software inspection services. The company offers discovery mapping analytics and automated software inspection
2497,Celestry,Provider of physical design products. The company offers software and services to electronic and semiconductor
2498,Vumber,"Provider of anyphone, anytime, anywhere phone number that keeps users identity private. The company offers"
2499,Boundless Learning,"Provider of e-learning services. The company offers online educational content for students, educators, and self-learners."
2500,Primary Health,"Operator of a healthcare delivery system for health insurance companies, self-insured employer groups, and medical"
2501,Coelacanth Chemical,Provider of proprietary chemistry technologies to rapidly discover new chemical entities for drug development and
2502,Epitome Biosystems,Developer of technology to measure protein biomarkers and intracellular infrastruture. The company has developed a
2503,OneSchool,Provider of a mobile platform that acts as an online guide to U.S. college campuses.
2504,SecureInfo,"Provider of cyberspace security. The company provides a cloud-based, online-security platform for government, cloud technology"
2505,Communicado,Provider of solutions for managing converged voice/data communication networks that carry real-time person-to-person business communications.The
2506,Netect,Provider of security software. The company provides security assessment and systems management software that identify
2507,Goshme Solucoes Para a Internet,Developer and provider of search engine. The company assists users by providing a list of
2508,Cameraworld.com,Provider of online shopping site for photographic equipment and digital imaging. The company is a
2509,LoSo,"Provider of location-based social media application. The company\'s platform delivers real-time advertisements, local deals and"
2510,mInfo,Provider of multi-transport mobile search services. The company also provides mobile marketing tools to both
2511,CellPro,"Developer of devices used in biotechnology. The company develops continuous-flow, cell-selection systems that can be"
2512,Industrial Tooling & Fabrication,Supplier of heavy-gauge steel components and assemblies. The company offers tool and die and machining
2513,Mackmyra Svensk Whisky,"Mackmyra Svensk Whisky AB is engaged in manufacturing, sales and marketing of malt whiskey and"
2514,Axent,Provider of enterprise-grade security software. The company provides an integrated suite of software designed to
2515,Hybrid Graphics,Developer of embedded 2D and 3D graphics software for handheld devices. The company develops graphics
2516,Engagor,"Provider of an online platform for real-time customer engagement, social media monitoring and analytics. The"
2517,Platinnetz,Provider of an online community and marketing channel for people 40 and older in Germany.
2518,iLink Global,Provider of eLogistics application services. The company provides shipment pricing and logistics services for e-commerce
2519,Swap.com (Acquired 2012),Provider of an online goods exchange platform. The company operates an online platform that allows
2520,Deal Pilot,Provider of comparison shopping services trough an online website. The company provides search engines for
2521,Nelson House,Operator of a mental rehabilitation hospital. The company offers care and treatment to male patients
2522,FTAPI Software,Provider of software for the secure transmission and storage of data. The company\'s data space
2523,Avalon Photonics,"Manufacturer of vertical cavity surface emitting lasers (VCSELs). The company manufactures VCSELs for the datacom,"
2524,Wibiya,"Developer of customized web toolbars for websites. The company help online publishers, bloggers ,and other"
2525,Mobyson Holding,"Provider of mobile IP telephony services. The company markets telephony provisions, including hardware and software"
2526,Shepherd Intelligent Systems,Provider of real-time fleet management software services. The company offers a suite of software tools
2527,HylioSoft,"Developer of web mapping applications. The company offers an application which allows users to create,"
2528,Opzi,Developer of social games. The company is the creator of games that can be played
2529,Toumaz Technology,"Developer of radio frequency, analogue and mixed-signal semiconductors. The company focuses on development of low"
2530,Clean Filtration Technologies,"Developer of water treatment technology. The company produces the CFT Turboclone hydroclone system, a patented"
2531,Douro Azul,Owner and operator of river cruise ships on the Douro River in Portugal. The company
2532,Rawporter,Provider of online raw video and photos. The company provides photos and videos that are
2533,MyETone,Provider of a product review and price comparison portal. The company provides a platform to
2534,SENSeOR,Designer and developer of complete sensor systems for measuring physical quantity or determining the presence
2535,Tello,Developer of SaaS and mobile application for customer feedback. The company provides web and mobile
2536,HistoRX,Developer of tissue-based theranostic solutions for individualized patient care. The company provides customized biomarker assays
2537,NextPage,Provider of technological services to businesses to track and manage documents. The company provides services
2538,Queplix,"Developer of information access solutions for retail, manufacturing, telecommunications, energy, software, and healthcare sectors. The"
2539,PineBrook Imaging Technology,"Manufacturer of computers and electronics. The company primarily manufactures computers, electronics, semiconductors and microchips."
2540,Auto.nl,Provider of a subscription car service in the Netherlands. The company provides a car service
2541,Ample Medical,Manufacturer of endovascular medical devices for repairing heart valves. The company develops medical devices that
2542,Vigix,"Provider of self-service retail kiosks. The company offers self-service, dispensing kiosks for selling products ranging"
2543,InfoJobs Spain,Developer of an online job platform. The company provides a digital platform that offers employment
2544,Equitant,Provider of working capital management solutions to large enterprises. The company\'s order-to-cash management services provides
2545,TVGenesis,"Provider of the digital broadcast platform. The company provides digital broadcast platform, engaging audiences across"
2546,Novabase,"Novabase SGPS provides business solutions, infrastructures & managed services and venture capital solutions to government"
2547,DCF Technologies,Provider of services for eliminating data retrieval bottlenecks. The company offers software services to access
2548,Alsensa,"Developer of products for allergy diagnosis. The company engages in design, research, development and manufacture"
2549,Biofisica,Developer of medical devices that trigger the healing process in wounds that fail to heal
2550,Ardea Biosciences,"Developer of small-molecule therapeutics. The company provides therapeutics for the treatment of gout, cancer and"
2551,Cyber-Rain,"Manufacturer of wireless sprinkler control systems for homeowners, property managers, building owners and landscape contractors."
2552,Angle Wind,Developer of mechanical gearbox and drive train for wind turbines. The company develops eccentric gearboxes
2553,Spectra Biomedical,Operator of a biotechnology company focused on neurological conditions. The company provides research into the
2554,RotaryView,"Developer of mobile applications for e-commerce websites. The company enables the users to shoot, upload"
2555,BiddingAce,Operator of an online marketplace for buying and selling general aviation aircraft. The company provides
2556,Berlin Heart,"Developer, producer and marketer of innovative devices for mechanically supporting the heart. The company offers"
2557,Actional,Provider of service-oriented architecture management and security solutions. The company\'s Control Brokers give market-facing e-business
2558,TransCella,Developer of technology for utilization of multi core processors.
2559,VasoNova,Developer of vascular navigation systems for healthcare providers and clinicians. The company provides VasoNova Vascular
2560,Gradient X,Provider of a programmatic marketing platform for mobile advertising. The company\'s platform solution for mobile
2561,Exponaute,"Operator of an online platform for information and services on exhibitions in Paris, France, Belgium"
2562,Invesco PowerShares Capital Management,"Provider of investment management services. The company invests in the public equity, fixed income, currency"
2563,DenX Advanced Dental Systems,Provider of dental teaching and practicing technologies to dental surgeons and dental schools worldwide to
2564,Corticon Technologies,Provider of business rules management solutions for companies to model and automate recurring decisions in
2565,Alpha Microelectronics,Manufacturer of fabless semiconductors. The company manufactures fabless semiconductors for custom-specific and standard ICs. It
2566,Spikes Cavell & Co,"Provider of business intelligence, online tools and analytical insight to decision makers in the public"
2567,Dblur technology,Developer of software lens technology.The company develops software solutions mainly for camera manufacturers. The company
2568,Yandex,Operator of an Internet search engine in Russia. The company offers access to a range
2569,Signase,Developer of small molecule inhibitors of a critical cell pathway for the treatment of a
2570,RAD Electronics,"Provider of outsourced electronics manufacturing services. The company manufactures complex printed circuit boards, custom and"
2571,FreakOut,Provider of digital marketing platforms. The company develops demand-side platform for smartphone advertising and real-time
2572,Superior Access Insurance Services,Distributor of online insurance. The company provides insurance agents with access to range of insurance
2573,RocketCash,Provider of online incentive programs. The company is an online gateway that enables consumers to
2574,PostX,Provider of email encryption technology for enterprises.
2575,Apsylog,Provider of IT asset-management software. The company provides a decision-support software platform that manages the
2576,NetOps,"Developer of software products for testing, infrastructure health monitoring and fault detection. The company develops"
2577,Flatirons Solutions,Provider of XML-based software and services. The company offers professional services for information management in
2578,Infosec,Provider of products and services for cyber-security. The company offers various services including security management
2579,Benchmarq,Provider of power-sensitive and portable electronic systems. The company provides integrated IC and module solutions
2580,GenesisTP,Provider of light-steel building technologies. The company specializes in manufacturing of light-steel framed structures which
2581,GenEncap,"Developer of DNA sequencing technology. The company provides DNA sequence information to life scientists, clinicians"
2582,Equipamientos Europeos 2005,Manufacturer of commercial vehicles with energy-saving technologies. The company develops and commercializes medium-tonnage trucks for
2583,Brain Institucional,Operator of a human resource company in Brazil.
2584,Twinstrand Therapeutics,"Operator of biopharmaceutical company. The company engages in the discovery, development and commercialization of biological"
2585,SurgiQuest,"Provider of technology services for minimally invasive surgery. The company offers AirSeal, a technology that"
2586,Vaillant Stadium Limits,Developer of equipment for tracing boundaries. The company has designed and developed a system of
2587,DownstreamEnergy.com,Provider of solutions for supply chain management. The company provides software programs that manages flow
2588,Rocket Travel,Provider of a hotel-booking website offering free airline miles as a booking incentive. The company
2589,AEP Networks,"Developer of security and communications technologies to governments, enterprises and carriers in the United Kingdom"
2590,ExperienceOn Ventures,Operator of a website which will make internet hotel search faster. The company offers flexible
2591,Terracotta,"Developer of software products for enterprise application scalability, availability, and performance optimization. The company’s products"
2592,UpdateLogic,Provider of a device management system for consumer electronics manufacturers to control and maintain internet
2593,Wellness Indicators,Provider of a wellness screening test. The company develops and manufactures a dry urinary wellness
2594,Teleportd,"Provider of a social media marketing platform. The company provides Nitrogram, a marketing and social"
2595,Trading Dynamics,Provider of business-to-business Internet trading applications that enable Internet market makers and corporations deploy and
2596,Phorus,Developer of digital audio systems which connected wirelessly with automobiles.
2597,Wiffledan,Developer of photo capturing application. The company finds amazing photos hidden inside video through the
2598,Signal Innovations Group,Developer of decision systems for various sensor and data types for government customers and industry
2599,Nuvon,"Provider of medical devices for real-time event monitoring, notification and management. The company is engaged"
2600,Cambridge Silicon Radio (Mobile Business),Developer of mobile chip and handset. The company provides technology for handset connectivity.
2601,GroupTalent,Provider of a hiring platform that brings together talent and employers. The company aims to
2602,Tre Trapp,Producer of indoor wooden staircases. The company manufactures custom designed wooden staircases for homes using
2603,Medical Gas Solutions,Manufacturer and distributor of a medical gases and device. The company manufacturer medical gases and
2604,GlooLabs,Developer of multimedia platform for embedded devices and remote access services. The company\'s technology enables
2605,5Rocks,Provider of business intelligence tools for mobile gaming developers. The company develops and provides analytics
2606,Coveroo,Producer of custom cell phone covers and cases. The company develops back cover on the
2607,Snaptu,"Provider of online solutions for mobile devices. The company offers Snaptu, an application that turns"
2608,HopStop.com,Developer of a mobile application for pedestrian-friendly directions and information. The company is the creator
2609,Napkin Labs,"Provider of online market research platform. The company provides crowdsourcing platform to get market research,"
2610,NativeMinds,"Provider of Virtual Representatives or vRepsTM, which offers self-service solutions for Web customers. The company\'s"
2611,Rahu Catalytics,"Developer of catalysts, activators, accelerators and other chemicals for industrial applications. The company develops iron-ligand"
2612,Affimed Therapeutics,Developer of unique TandAb antibody therapeutics for cancer and inflammatory diseases. The company offers anticancer
2613,ID Analytics,Provider of identity risk and fraud management services in the United States. The company offers
2614,Virtuata,Developer of new technology for security software. The company provides innovative capabilities for securing virtual
2615,Elevator Labs,"Provider of finance, technical and strategic guidance to start-ups."
2616,Erenis,Operator of optical fiber equipments to deliver telecommunication services in the French residential market. The
2617,KB Labs,Developer of facebook applications. The company develops Facebook applications and widgets.
2618,IDev Technologies,"Developer of medical devices for interventional radiology, gastroenterology, vascular surgery and cardiology surgery. The company"
2619,Mixcommerce,Provider of e-commerce services for brands. The company focuses on the creation and production of
2620,gp3 Groupe Conseil,Provider of consulting services. The company helps departments and agencies to implement their strategic plan
2621,DRV Energy,Operator of fuel centers and fill stations. The company provides full service alternative fuels center
2622,Maconomy,Developer of enterprise project optimization (EPO) software. The company develops advertising applications on Apple\'s Macintosh
2623,Ofidium,Developer of OFDM technologies. The company provides 100 Gigabits per second optical optical OFDM technologies
2624,Felix,Provider of pay per call ad service. The company provides service that helps businesses synchronize
2625,SteLar Tools,Developer of software applications for the electronic design automation industry. The company provides graphical and
2626,Monthsof.me,Provider of online platform to share visual stories. The company provides a platform for users
2627,7digital,"Provider of digital media platform. The company provides digital download services, including music and video"
2628,eNovance,Provider of open source cloud computing and multi cloud management services. The company provides managed
2629,Xponent Photonics,"Provider of semiconductor processing technology. The company\'s product Surface Mount Photonics (""SMP""), include a range"
2630,Anthillz,"Provider of a business-networking website. The company provides a social platform for business people, and"
2631,Excilan,Provider of payment and authentication platform. The company allows mobile subscribers to access and pay
2632,Southwest Nanotechnologies,Manufacturer of single wall carbon nanotubes. The company develops carbon nanotubes using catalytic method in
2633,AGM,"Developer of 3-D geological interpretation software. The company offers Recon, a 3-D geological interpretation software"
