,name,desc
0,Octagen,"Operator of biopharmaceutical company. The company develops drugs for hemophilia, other genetic disorders and variations"
1,GeckoGo,Operator of an online travel website. The company provides travel website for travelers which enables
2,Yantra,"Provider of distributed order management and supply chain fulfillment solutions for retail, distribution, logistics, and"
3,Insider Pages,Operator of online directory and reviews site in the United States. The company enables people
4,GrindMedia,Provider of online action sports and entertainment content. The company provides adventure sports and entertainment
5,Discovery Engine,Developer of an internet search engine. The company offers an interaction model of search engine
6,Pictos Technologies,"Provider of semiconductor and imaging products. The company designs, manufactures and markets digital imaging semiconductor"
7,OnForce,Provider of a cloud-based platform to procure and manage independent IT workforces. The company provides
8,CEB Merchandise Brokers,"Wholesaler of custom apparel and promotional items. The company specializes in brand design, screen printing,"
9,WedSnap,Developer of Web applications to wedding consultants and Website developers. The company offers tools that
10,Prepay Technologies,Designer of stored-value card solutions. The company provides clients with integrated portfolio of prepaid services.
11,SaltCheck,Developer of a technology to monitor salt intake for the control of hypertension and congestive
12,SmartRM,"Developer of encryption software that allows users to protect and share digital content, such as"
13,Restricted Stock Systems,Provider of software services to financial institutions and public companies. The company provides commercial software
14,Metreo,Provider of pricing optimization software. The company provides pricing optimization software that enables manufacturers and
15,Transparency Software,Developer of information retrieval software for business enterprises. The company’s core product Transparency Vision is
16,BioScan Technologies,Developer of imaging technology for use in interventional vascular applications. The company is the developer
17,BambooTori,"Operator of a restaurant chain. The company provides Japanese food and serves all-natural chicken, beef,"
18,Evomote,Provider of content discovery services. The company develops an online platform that helps in offering
19,Xaar,Developer of ink jet technologies.
20,Sepro Telecom International,Developer and provider of rating and billing software. The company develops rating and billing software
21,Foodik.ru,Provider of an online food ordering service in Russia. The company provides convenience to customers
22,Affinity Payments,Provider of payment platform. The company provides electronic payment services to merchants and partners.
23,Targanta Therapeutics,Developer of innovative antibiotics to treat serious infections in the hospital and other institutional settings.
24,Microgon,"Manufacturer of biotechnological separation, filtration and OEM medical devices. The company produces hollow-fiber membrane filters"
25,Samba Sensors,Manufacturer of pressure-measuring system based on fiber optics and micromechanics. The company\'s pressure sensors are
26,BlackLocus,"Provider of a cloud-based platform for online retailers that provide recommendations on pricing, inventory management"
27,Opalis Software,Provider of an information technology (IT) process automation software products for the enterprises. The company
28,GoInstant,Developer of shared web-browsing tool. The company\'s unique co-browsing tool allows two or more people
29,Signature Labs,Developer of a mobile shopping assistant and shopping application. The company provides a way to
30,Pulsent,"Developer of video compression algorithms, technologies and products. The company offers algorithms, software and hardware"
31,Ixi Mobile,Developer of data centric wireless mobile devices and services for mass market users. The company
32,Loomia,Provider of content recommendation services.
33,Envolure,"Developer and provider of a biological, enzymatic and chemical catalog for the characterization of waste"
34,SCT Spinal Cord Therapeutics,Developer of therapy for acute and chronic spinal cord injuries. The company focuses on the
35,Rivio,Developer and deliver small business Web services. The company\'s Integrated Business Services Network (iBSN) provides
36,HAPTO Biotech,Developer of fibrin derived platform technologies. The company offers Fibrin Micro Beads for stem cell
37,BioMonde (Acquired by ZooBiotic),Manufacturer of larval therapy products used to treat wounds like diabetic ulcers and orthopaedic wounds.
38,ClimateMinder,Provider of wireless climate monitoring and control systems for agriculture. The company offers products that
39,KinetX IP (software assets and a specialized business unit),"Provider of space systems engineering, software engineering, hardware engineering, project management, space navigation, flight dynamics"
40,Umbria,Provider of internet related research and marketing advice. The company collects the unsolicited opinions and
41,SocialCast (Waltham),Provider of end-to-end social media services. The company provides a cloud-based platform for small and
42,Zattikka,Developer of online and mobile social network games and mobile applications. The company develops and
43,Intervaluenet,Provider of Internet-consulting services. The company offers Internet stategies for Web-based businesses.
44,LZ Therapeutics,Developer of therapeutics for patients at different stages of Parkinson’s disease. The company provides neuroprotective/neurorestoritive
45,Savene (European Assets),Provider of detoxifying agents. The company specializes in providing dexrazoxane to prevent the effect of
46,Preclick,"Provider of retail photo software for digital photographers. The company\'s solutions enables users to organize,"
47,MMIC Solutions,Developer of technology for systems operating in the millimeter wave bands (50 GHz to 250
48,Kingdee International Software Group Co.,Provider of enterprise management software and Internet service in Asia. The company is a provider
49,Actions Semiconductor,"A fabless semiconductor company which designs, develops and markets integrated platform solutions, including SoCs, firmware,"
50,Ion Surgical Technologies,Developer of medical alternatives to surgical implants. The company is focused on providing surgeons with
51,Piano media,Provider of payment services to the media publishing industry. The company enables publishers to monetize
52,Bedo Technologies,Provider of LBS application and service. The company\'s product enables users to take real-time location-based
53,Mountain Network Solutions,"Provider of mainframe storage services. The company also provides hosting, storage and disaster recovery services."
54,Twisted Pair Solutions,"Provider of unified communications software services. The company offers WAVE, a Voice-over-IP software application that"
55,HL-Planartechnik,Manufacturer of thin-film metallization processes for the production of sensors. The company manufactures and sells
56,Elastix,Provider of technology that lowers the power used by digital integrated circuits. The company offers
57,Buysight,Provider of search engine marketing platform for display advertising. The company provides services for both
58,CellTran,Developer of cell therapy products to aid in wound healing. The company using autologous skin
59,Biocistronix,Provider of drug discovery and medical research and development services. The company also engages in
60,Advasense Technologies,Developer of image sensor technologies. The company offers technologies used in improving the image quality
61,Glancee,"Provider of is an application for iPhone, Android and Facebook."
62,EA Technology Ventures,Provider of power asset management services. The company invests and works with new ventures across
63,SwitchGear Genomics,Provider of products for studying gene regulation in the human genome. The company develops new
64,Frog AGV Systems,"Developer of navigation hardware and software products. The company develops, produces and sells guidance and"
65,Pomarfin,Operator of a Finnish family business that manufactures shoes.
66,Slide,"Provider of online application for social networking websites. The company provides slideshow, image and video"
67,Newton Propulsion Technology,Developer of hybrid propulsion technology based engine. The company\'s product is a hybrid of the
68,Waywire,"Provider of a social artery for video news. The company\'s network provides original, syndicated and"
69,Zebido.com,Operator of an auction website.
70,LCL Logistix,"Provider of logistics and supply-chain solutions. The company provides integrated, end-to-end shipping logistics services to"
71,CrystalVoice,Provider of quality-of service-software for VoIP solutions.
72,FYIQuest,Developer of an internet-based system that provides customized content to physicians\' offices. The company provides
73,Efficere Technologies,Developer of software for electronic systems. The company manufactures and markets signal integrity devices. The
74,Tutum,Developer of a cloud computing service platform. The company provides a cloud service focused on
75,Danyl,Manufacturer of electronic data collection which input to computerized accounting systems. The company also produces
76,MyBuys,Provider of cross-channel personalization for brands and retailers. The company offers web recommendations and personalized
77,eShare Technologies,Provider of real-time customer and interactive communication services for e-commerce and online communities. The company\'s
78,Agouron Pharmaceuticals,"Developer of therapeutic products to treat cancer and AIDS. The company engages in the discovery,"
79,Aduva,"Developer of software applications for maintaining Linux computer systems. The company\'s product, Aduva OnStage, is"
80,Sinclair Meadows,Provider of residential houses and apartments. The company has seventeen home-sites along with restaurants and
81,Yepler,"Creator of an online social desktop community. The company\'s platform enables users to organize files,"
82,AccuDraft,Provider of business document automation services and online document production software. The company offers DocsEngine
83,Smart Button Associates,Provider of a web-based marketing platform. The company engages in rewarding and retaining their customers
84,Connectiva Systems,Developer of revenue management software products. The company provides revenue and risk management software that
85,Advanced DX,"Provider of testing equipment and personnel for diagnosis of clinical conditions including diabetic retinopathy, neuropathies"
86,Provost Systems,Provider of administrative and academic solutions for charter schools. The company provides web-services like Provost
87,LiveTime Software,Developer of IT service management software. The company provides a platform one of reactive incident
88,Regiohelden,Provider of online marketing services. The company helps local advertisers with search engine marketing software
89,Adify,Provider of the technology and back office services necessary for companies to run their own
90,Dapper,Provider of an advertising technology platform for creating dynamic display advertisements. The company provides a
91,Fotolog,Operator of a social networking site. The company’s site enables members to express themselves through
92,Comarch,Provider of IT products for operational and business processes. The company provides CRM and business
93,NowMedia,Provider of an online platform for live video streaming of events. The company engages in
94,Fiomi Diagnostics,Manufacturer and marketer of diagnostic test kits. The company also develops a panel of point-of-care
95,Telemic,Provider of wireless based remote sensing technologies for lighting and other applications. The company offers
96,Masimo,Manufacturer of innovative noninvasive patient monitoring technologies. The company offers noninvasive blood constituent patient monitoring
97,Empowered Careers,"Provider of online education services. The company has partnered with the University of California, Los"
98,ishoni Networks,Developer of broadband communication gateway technology. The company develops highly integrated Broadband Gateway Engines for
99,Gazoontite,"Provider of household products. The company provides products that help reduce asthma problems, allergies and"
100,Ultranat,Provider of technologies for the treatment of power plant waste ash. The company\'s technology enables
101,TestSource,"Provider of behavioral-based, pre-employment assessments for the healthcare industry. The company offers healthcare selection inventory"
102,LeftHand Networks,"Provider of flexible IP-SAN network storage solutions. The company also offers evaluation software, such as"
103,01 Communique Laboratory,Developer and provider of communication software and services. The company develops and markets remote access
104,Five Guys Restaurants (8 sites ),"Portfolio of 8 restaurants. The restaurants are located across central California including Elk Grove, Fresno,"
105,Paypal,Provider of a digital wallet and online payment services for individuals and businesses. The company
106,Circle of Moms,Provider of a community website platform for mothers. The company enables mothers to connect with
107,Sound Surgical Technologies,Manufacturer and seller of surgical and non-invasive body shaping products utilizing ultrasound technology. The company
108,Encounter Development Technologies,"Provider of end-to-end technology and online marketing services, including design, build, hosting and online marketing"
109,Aptara,"Provider of digital publishing software. The company offers PowerXEditor, an online authoring tool that focuses"
110,Reconda International,"Developer of web services extender applications. The company developed QN-AppWatch, a Web-based WebSphere MQ administration"
111,Quality Care Solutions,Developer of platform software products for the healthcare industry. The company provides healthcare claims administration
112,Decuma,"Developer of handwriting recognition software for wireless devices such as mobile phones, PDAs and digital"
113,Zip2,Operator of a mobile media company which creates applications that enable business partners to engage
114,Cellular-Blowout,"Provider of wireless products and services. The company provides cell phones, PDA, mobile software, phone"
115,Fredio,Developer of a video broadcasting application. The company offers internet video content accessible on internet
116,Allerez,"Provider of web-based information, real-time and disparate data sources. The company integrates disparate data sources"
117,Encampment Minerals,"Explorer of natural resources. The company is engaged in the exploration of copper, nickel, and"
118,OSspray,Developer of dental products. The company develops products that utilize air polishing technologies for the
119,No Wires Needed,Developer of wireless technologies. The company manufactures wireless products designed to enable high-speed wireless Internet
120,Open Monoclonal Technology,Developer of human monoclonal antibody platforms. The company develops human therapeutic antibodies based on transgenic
121,Microposite,Manufacturer of siding for buildings. The company offers siding and outside seal products and boards
122,Eridon,Provider of a complete platform for embedded system design. The company offers embedded system technology
123,Evotec International,Manufacturer of biopharmaceutical products. The company develops therapies for metabolic disorders based on model organisms
124,Oxford BioMedica,Developer of gene-based medicines and therapeutic vaccines. The company\'s technology platform includes a gene delivery
125,CreativeHub,Designer and Developer of websites and Builder of mobile and social media applications for entrepreneurial
126,Maptuit,Provider of navigation solutions to the transportation industry in the United States. The company specializes
127,OKWave,Operator of a question-answering website. The company provides a platform for users to solve their
128,Echoecho Media,"Developer of a location-based mobile application for finding friends. The company offers an open API,"
129,Bright View Technologies,Developer of microstructure-based optical films. The company offers LCD backlight films; light management film product
130,Carefx,Provider of information technology solutions to the healthcare organizations in North America and Europe. The
131,SilverSky,Provider of on demand security services for computer networks in the United States. The company\'s
132,Epocal,Provider of biochips and micro-fabrication of solid-state diagnostic devices. The company is implementing an entire
133,Chemrec,Developer of manufacturing technology for biofuels. The company provides a proprietary black liquor gasification technology
134,Indeed,Provider of an online job searching portal. The company acts as an external source of
135,TraceDetect,Provider of new chemical and optical sensors. The company provides research and commercialization of new
136,Frontlineshop,"Provider of an online retail store for streetwear. The company offers clothing, shoes and accessories"
137,ShowBiz Data,Provider of a B2B portal for the global entertainment industry. The company provides detailed information
138,Potomac Research Group,Provider of Washington policy analysis to institutional investors. The company provides market technical analysis and
139,Verrillon,"Manufacturer of specialty optical fibers and components for oil and gas, military, avionics, industrial and"
140,Resonex,Manufacturer of magnetic resonance imaging devices. The company manufactures and sells magnetic resonance imaging devices.
141,FCS Control Systems,Developer of electromechanical and electro hydraulic flight and vehicle simulation equipment. The company develops a
142,Triformix,"Manufacturer of precision polymer optic and opto-electronic systems. The company also provides medical devices, such"
143,QTY Systems,Manufacturer of machinery to apply insulation. The company develops machinery to automate the process of
144,Íshestar,Provider of horseback tours in Iceland. The company is an operator of equestrian-tourism services in
145,American Overseas Group,Provider of non-standard auto insurance. The company operates as a professional reinsurer through subsidiaries in
146,Virtual Computer,"Provider of a platform of PC life cycle management. The company offers NxTop, a client-side"
147,CheckFree,"Provider of electronic commerce services. The company provides electronic billing and electronic statement creation, delivery,"
148,Jolt Online Gaming,Developer and publisher of free to play browser and social games. The company develops and
149,Dot Wireless,"Developer of semiconductor chip sets, embedded communication protocol software, hardware reference solutions and semiconductor intellectual"
150,Kaffee Toro,Operator of an online subscription platform for coffee drinkers. The company provides online subscription services
151,Top Ten Media,Provider of media content on entertainment topics from the Web. The company draws information from
152,MCN,Provider of mobile search and advertising technology platform. The company provides advertising services to operators
153,Circular,Provider of user preference based online content. The company offers an infinitely scrolling feed of
154,Social Genius,Developer of social music application for smartphone that combines game mechanics with interactive radio stations.
155,MLRGB Restauration,Provider of steam cooked food products. The company operates as a restaurant serving steamed food
156,Hamilton Pharmaceuticals,Developer of medical treatments for diseases related to central nervous system. The company engages in
157,China Yachting Business Partnership,"Developer of China recreational boating industry. The company engages in boat manufacturing, full service marina"
158,Raster Graphics,Developer and manufacturer of large format digital color printing systems. The company is engaged in
159,Virtual Expert Clinics,Developer of an educational therapy supports for schools and districts to educate students with developmental
160,Care Team Connect,Provider of a care coordination platform. The company provides a technology platforms to coordinate between
161,Bongomagic,Provider of a platform for social-network marketing services. The company provides a platform that enables
162,Aristo Technology,Developer and marketer of design planning and assembly tools for complex IC and system-on-chip (SOC)
163,Precision Beam,Provider of laser cutting services. The company provides laser cutting and welding services in United
164,Liquiverse,Provider of a software for editing complex data lists in diagrams. The company develops and
165,Playtomic,Provider of analytics and services for casual and social games. The company\'s platform acts as
166,Cierra,Developer of novel therapies for the minimally invasive treatment of patent foramen ovale. The company
167,Ignition Mobile,Promoter of mobile applications. The company provides a platform offering exclusive deals for free applications.
168,SmartReceipt,Provider of personalized nutrition and marketing messages that enable consumers to make better food decisions.
169,Lookcraft,Retailer of curated men\'s apparel and accessories. The company provides men with clothing and accessories
170,Quidsi,"Operator of an online retail shop for baby care, health, beauty, and household essentials. The"
171,SocialEngine,Provider of an online community that rewards members for posting great content. The company provides
172,Network,Owner and operator of a social networking site for professionals. The company allows professionals to
173,Garage Sallaberry,"Provider of automobile repair services. The company engages in the maintenance, repair and servicing of"
174,Aspective,"Provider of e-commerce and WAP-based mobile applications and services for customer relationship management, business intelligence,"
175,eShip-4u,Provider of value added hardware and software services for the logistics and courier service industry.
176,Röntec,Developer of devices for X-ray elemental and structural analysis. The company offers x-ray spectrometers used
177,Amerigroup,Provider of managed healthcare services. The company focuses on serving people who receive healthcare benefits
178,Cemaphore Systems,Developer of e-mail continuity and content management solutions for the Microsoft Exchange. The company\'s products
179,PIA-Engineering,"Manufacturer of moving and lifting appliances. The company designs and delivers rolling, moving, sliding and"
180,Watch Hill Partners (CRM Program),Provider of electronic customer relationship management and technical service offerings. The company is a management
181,Sim Skin,Manufacturer of medical surgery training tool. The company manufactures surgical training model useful in surgical
182,Dynamotive Energy Systems,Provider of services for the conversion of biomass to liquid fuel. The company\'s pyrolysis technology
183,CircuLite,Developer of miniature blood pumps for the long-term treatment of chronic heart failure. The company
184,Avicenna Systems,Operator of an internet based healthcare information company. The company develops intranets for managed health
185,CTP Hydrogen,"Developer of a fuel reformer. The company\'s reformer generates pure hydrogen from conventional liquid fuels,"
186,Concurrent Thinking,Provider of computing systems and software. The company is involved in designing and implementation of
187,Chip Xonio Online,Provider information technology services. The company specializes in consumer technologies and also operates computer portal
188,Roomtag,Developer of a space management software. The company provides a web-based space management software that
189,Nisamest,Developer and provider of an enterprise resource planning software. The company offers product for financial
190,NYX Gaming Group,"Provider of hosted social gaming applications, social media, mobile, lottery games, play slots and games"
191,WaferScale Integration,Manufacturer of field-programmable peripheral integrated circuits. The company produces non-volatile PROM and EPROM memory products
192,fiveby tv,Provider of online videos based on user preference. The company scours the internet for the
193,Rewind.Me,Provider of platform that enables collection and organization of personal data. The company enables its
194,Google DeepMind,Developer of artificial intelligence technologies. The company combines machine learning and systems neuroscience to build
195,Foveon,Developer of an image sensor technology for digital capture products. The company offers pixel image
196,ModeWalk,Provider of online marketplace for luxury designers and craftsmen. The company enables luxury designers and
197,LeagueLink,Provider of web based league administration tools for the sports market. The company\'s product consists
198,Alveolus,"Developer of non-vascular interventional stent technology. The company designs, develops and manufactures non-vascular interventional stent"
199,OVIVO Mobile Communication,"Provider of mobile network services. The company provides free calls, texts and data each month,"
200,Silitech Technology,Manufacturer of silicon rubber keymats. The company engages in developing mechanism parts of mobile phones.
201,Matan Digital Printers,Manufacturer of professional digital printers. The company designs and manufactures printing equipment for three major
202,Legends Optical 4.0,Operator of optical laboratories. The company provides facility equipped with the lens processing technology.
203,Cloudy,Provider of mobile social decisioning platform. The company\'s online social platform allows users to ask
204,Alinea Pharmaceuticals,Develop of therapeutics for the treatment of diabetes and other metabolic disorders. The company also
